"제주도에 가서 처음으로 이런 전설이 있다는 것을 알았습니다. 3인의 성(姓)이 생긴 전설이 있어, 여기서 그 사람들이 나왔다는 내용이었던 것 같습니다. 처음에 그 이야기의 애니메이션을 보는 영화관이 있어서, 그걸로 내용을 안 다음 그 장소를 돌았어요. 거기서 3인의 남성의 부인은 일본인이 배를 타고 왔다는 내용이었던 것으로 기억합니다. 하지만 실제 구멍은 울타리 때문에 조금 멀어서 보기 힘듭니다.
제주도 역사 같은 건 몰랐기 때문에 와-! 하는 느낌으로 공부가 되었어요.",삼성혈,교육
"제주도의 조상으로 여겨지는 3인을 모신 공원으로 전시실 애니메이션에서는 일본어를 포함해 4개 언어 버전으로 전설을 설명해 주었다.

그래도 시간의 흐름을 느끼면서 공원 내에서 쉬기에는 매우 좋다.",삼성혈,교육
"사극을 좋아하시거나 우리 옛것을 좋아하시는 분들이 들를만한 곳입니다.
마치 내가 옛날 사또가 되어서 예전 관청이 어떤 곳인지 둘러보는 재미가 있을거 같습니다.",제주목 관야,교육
"원래 역사적인 의미가 있는 곳들을 관광하는 걸 좋아합니다. 그래서 찾았던 곳인데, 제주도의 역사를 공부하기 좋았던 곳이라 생각합니다. 공항에서 멀지 않은 곳에 있어서 다녀오는데 시간이 오래 걸리지도 않았고요. 조선시대, 중앙에서 파견된 제주목사들이 제주도에서 어떤 생활을 했는지도 알 수 있었습니다. 신청하면 해설사님의 안내를 들을 수도 있으니 한 번 해설을 들으면서 구경하셔도 좋을거 같아요.",제주목 관야,교육
들어가면 마음이 안정되고 한국식건축양식을 자녀들에게 소개하고 간간하게 아이들과 잉어들 먹이주면서 놀수있어서 좋았습니다.,제주목 관야,교육
지금의 제주도가 아닌 옛날의 제주도의 모습을 상상할 수 있는 공간이라 좋더라고요. 과거에는 배만 타고 육지와 제주를 오갔을 텐데 제주는 독립된 나라가 아니었을까 상상도 하기 되고요.,제주목 관야,교육
조용하고 깨끗해서 가볍게 다녀올만 합니다. 제주시 내에 있어서 접근성도 좋아요. 작은 박물관도 있어서 제주목관아의 역사에 대해 알수있습니다.,제주목 관야,교육
제주목 관아는 조선 시대부터 통치하던 전 정부 관저입니다. 역사적인시기에 제주가 어떻게 통치되고 있었는지 알려주기 때문에 매우 유익한 방문 장소. 정부 주택의 건축은 아름답습니다. 한국의 한복을 빌려이 아름다운 곳에서 멋진 사진을 찍을 수 있습니다. 10 월에 방문하면 유명한 제주 귤 사진을 찍을 수 있습니까? 제주목 관아에서 자랍니다.,제주목 관야,교육
"나는 박물관과 역사적인 건물의 팬이다. 이 상자는 모든 상자를 틱합니다. 지갑 친화적 인 항목, 영어로 된 훌륭한 정보, 우수한 화장실, 그리고 고대 의상을 입은 의상실.
약간의 처벌과 고문 장비를 포함하여 볼 수있는 재미있는 것들이 많으면 많습니다.
다른 많은 한국 박물관들과 역사적인 건물들처럼 잘 유지되고 있습니다.",제주목 관야,교육
우리가 반드시 지켜야 할 역사적 유물입니다. 그럼에도 불구하고 안타깝게도 우리가 지킬 수 있는 한계가 있다는 것을 여실히 보여주는 유물이라고 생각합니다. 앞으로 더욱더 잘 관리가 되기를 바랍니다.,관덕정,교육
자랑스러운 유네스코 세계문화유산인 석굴암,관덕정,교육
"학창시절에 단골로 찾았던 경주, 그리고 석굴암. 힘들게 토함산을 올라 구경한 석굴암 본존불은 다시 봐도 감탄스러운 명작임에 틀림없다. 사진촬영이 불가능해서 사진으로 담을 수는 없었지만, 본존불 앞에서는 발길이 잘 떨어지지 않았다.",관덕정,교육
토함산 중턱에 있는 석굴로 불국사와 함께 신라시대의 가장 유명한 문화재이다. 특히 굴 안의 석가여래좌상은 신라시대 최고의 걸작품으로 꼽힌다. 가는 길이 꼬불꼬불 쉽지 않지만 그래도 가볼만한 가치가 있는 곳이다.,관덕정,교육
"
경주 전체가 멋있고 좋았지만 석굴암이 그 중에 가장좋았고 보는 내내 너무 멋있고 압도되고 역사를 생각하니 마음이 아팠습니다.",관덕정,교육
관덕정을 통해 제주 역사를 알수 있던 교육적인 장소 공부하기도 좋음,관덕정,교육
10년전 방문햇을때 보단 뭔가 정리가 잘 된 듯한 느낌!!! 위대한 문화유산이며 잘 조존할 수 있기를! 불국사와 석굴암은 우리 문화의 긍지를 느끼게 합니다,관덕정,교육
아주 뛰어난 문화재로 유명한 석굴암. 일제시대 때 보수한게 오히려 더 안좋은 상황. 조상들이 얼마나 뛰어났는지 알 수 있어요.,관덕정,교육
건축가의 노고와 생각이 깊은 감명으로 오는 곳입니다.,관덕정,교육
"석굴암은 불국사를 건축한 분이 같은 시기에 함께 건축하였다고 하는 곳입니다. 예전에는 동해에 해가 뜨면 부처의 이마에 비추어 내부가 환하게 빛이 났다고 배웠는데. 일본인들이 해체하지만 않았어도 습기도 없을 정도로 매우 정교하게 잘 만든 건축물입니다만, 그 이후 습기가 잘 찬다고 합니다. 볼 것은 그리 없지만, 건축의 의미를 상기하면 꼭 가 보아야 할 곳입니다.",관덕정,교육
"경주는 자주 가는데 그때마다 꼭 들리는 곳이 국립박물관, 불국사 그리고 석굴암입니다. 버스를 타야해서 조금 번거롭지만 버스시간 잘맞춰 타면 가기도 쉽고 요즘 버스투어도 잘되어있으니 꼭 가보세요. 주차장에서 석굴암까지 걷는 산책로가 좋습니다",관덕정,교육
"불상 하나를 이용해 선조들의 얼을 팔아 수십년간 사기행각을 벌여온 돈벌이 수단임. 일말의 양심이라도 있으면 매년 수십만명에게 뜯어낸 돈으로 관람환경을 개선하든가, 그럴자신 없으면 광고를 해대질 말던가. 관광객들 입김 때문에 불쌍이 훼손될까 유리막으로 가려져서 제대로 보이진 않지만, 그안에서 신자들은 기도를 하고있는게 무슨 넌센스인지. 입장료 안받고 들여보내주는 신자들의 입김은 신성한 입김인가? 게다가 요즘 누가 플래시를 터뜨린다고 전 세계적으로 이보다 더 인정받는 문화유산들도 하지않는 유난은 다떨어대며 교통비에 입장료에 돈은 돈대로 받는게 얼마나 오만한 돈독에 올랐는지 적나라하게 보여준다. 교과서에서 받은 정기로 호기심삼아 한번쯤은 갈수는 있어도 두번이상을 절대로 갈곳이 못된다. ",관덕정,교육
갔을때 겨울이라서 좀 추웠지만 경비도 삼엄하고 볼수있는 시간도 적지만 유리벽 너머로 보이는 석굴암은 진짜 신비롭고 경건해진다.,관덕정,교육
"경주관광하면서 제일좋았던곳
주차하고 석굴암까지30분정도 걸어가면서 청설모도보고 경치도즐기고 좋았어요.
석굴암본존불상을 보는순간 힐링이됩니다.",관덕정,교육
비록 유리관 안에 있지만 부처님의 미소를 잊을 수 없었다. 온화하며 마음을 평온하게 하는 불상과 주변 자연경관이 그야말로 내가 대자연 안에 들어와 있구나하는 것을 느끼게 한다.,관덕정,교육
어릴때 방문 했을때랑은 전혀 다른 느낌으로 잘 보고 왔습니다 주차하고 쉬엄쉬엄 한시간 안되게 걸어올라갔는데 걷는거 좋아해서 그길도 좋았어요~ 그 옛날에 어떻게 이렇게 과학적으로 설계하고 지금도 보존 되는지 정말 신비롭게 다가 왔습니다 수학여행때는 줄서서 휙휙 둘러 보고 갔던 기억만 남아있어서 마치 처음 방문 하는 기분이였어요,관덕정,교육
"유명하지요 석굴암
문화재 보호를 위한다지만 이제는 유리로 봉인해 놓았구요.
사람도 많고, 관광철에는 올라가는 차도 엄청 막히구요.
한번은 볼만한데 꼭 봐야 하겠다 그런 정도는 아닙니다",관덕정,교육
불국사에서 석굴암으로 가는 버스 시간대를 잘 확인해서 보시길 추천드립니다. 걸음이 느리신 분이라면 여유있게 다니는 것이 좋습니다.,관덕정,교육
"불국사 근처이고 또 팩키지 관광객의 필수코스 입니다.
아침 동해에서 오는 햇살을 받는 대웅전 석불의 모습이 매우 웅장해서 동서양 관광객들의 발길을 붙잡습니다.",관덕정,교육
불국사를 온김에라는 가벼운 마음으로 갔다. 조금 아쉬웠다.,관덕정,교육
"불국사에서 상당히 험난한 차량도로로 이동해야 합니다.
그리고 30분 정도 더 걸어서 볼 수 있는건 석굴암 외부 뿐.
문화재 보존이라는 이유는 알고 있습니다만, 상당히 아쉽죠.

기대치를 낮추고 불국사부터 등산코스로 본다면 괜찮습니다. 불국사에서 2km이며, 사람들과 친숙한 다람쥐들이 인기를 끕니다.",관덕정,교육
"불국사앞 정류장에서 매시 40분에 버스가
다니고, 가는 길에 다람쥐들이 참 많았습니다.
등산을 하시는 분들은 불국사에서 2.2km라
많은 분들이 산길로도 방문합니다.
불국사 내부는 사진촬영이 금지되어 있고
수행중인 스님들이 계시니 조용한 관람을
해 주시면 좋을 것 같습니다.",관덕정,교육
불국사 공영주차장에 주차하고 불국사를 관람한 후 석굴암까지 올라가는 등산로을 따라 올라갔습니다. 50분정도 소요되었고 조금 힘들지만 멋진 숲길과 산길을 지날 수 있어 좋았습니다. 석굴암 본존불의 감동은 직접 보고 느껴보기바랍니다. 석굴암 주차장에 있는 버스정류장에서 12번 버스를 타고 불국사주차장으로 내려와서 차를 타고 이동하였습니다. 평일이라면 차를 운전하고 바로 석굴암주차장까지 가는 것도 좋겠습니다.,관덕정,교육
"경주 석굴암 석굴(慶州 石窟庵 石窟)은 대한민국 경상북도 경주시의 토함산 중턱(진현동 891)에 있는 석굴(石窟)로서 국보 24호로 지정되어 있다.[1] 신라 경덕왕 10년(751년), 당시 51세였던 김대성이 만들기 시작했고 20여년 후 완성되었다. 신라의 건축과 조형미술이 반영되어 있다. 석굴암의 원래 이름은 '석불사(石佛寺)'였으나, '석굴', '조가절' 등의 이름을 거쳐 일제강점기 이후로 석굴암으로 불리고 있다.

인위적으로 만들어진 석굴이며, 1913년 이후로 일제가 수차례 해체·조립·수리하기 전까지는 원형을 유지하였다. 현재는 부실 복원에 따른 습도 문제로 유리벽으로 막아 보존되고 있다.

석굴암은 건축, 수리, 기하학, 종교, 예술적인 가치와 독특한 건축미를 인정받아 불국사와 함께 1995년 유네스코가 지정한 세계문화유산이 되었다.",관덕정,교육
보통은 차로 올라가는데 불국사 옆으로 난 길 따라 걸어 올라가는 것도 참 좋더라구요 봄에 나무에 막 물 오르기 시작할 때 흙냄새 느끼며 올라가 보시길ㅎ,관덕정,교육
주차장에서 10-15분 정도 걸어서 들어가야하고 좀 아쉽지만 유리관 너머로만 불상을 볼 수 있음. 사진 불가. 경주에 간다면 한 번 쯤은 가볼만한 곳.,관덕정,교육
석굴암 가는길은 쉽지 않습니다. 차로 가야하고 산길을 가야하고 계단을 올라야 합니다. 그런데 석굴암은 너무 멀리 그것도 투명막 뒤에서만 봐야합니다. 정말 보호하려는 것일까요? 그럼 그 안에서 불경을 드리고 절을 하시는 분들은 무엇일까요?,관덕정,교육
조용한 산에 위치한 석굴암을 찾아가는데 길이 쉽지 않았지만 가서 보고 감탄 하였습니다. 사실 국시책에서는 엄청 크게 봤는데 조금 작아서 실망하긴 했지만 그래도 옛 선조들의 고생이 생각나서 더 멋져보였네요!,관덕정,교육
가는 길이 쉽지 않아서 방문객이 많으면 고생이 많을 것 같아요. 여유를 가지고 등산한다는 기분으로 가시는게 좋을 것 같아요. 그리고 석굴암 현장에는 조금 더 관람의 이해를 도와주는 시각자료가 있었으면 좋을 것 같습니다.,관덕정,교육
"통일 신라의 절 ""석굴암""
한국의 대표적인 석굴사찰인 석굴암~~
경주에가면 불국사와 석굴암은 필수에요
예전엔 수학여행으로 가기싫어도 갔던곳인데
이제는 무조건 찾게 되는곳^^
경건함이 느껴집니다..",관덕정,교육
토함산 자락의 한 계곡에 부처님이 모셔져 있다. 주차장에서 20여분 걸어가면 석굴안에 돌로 만들어져 있는 부처님이 앉아 계신다~,관덕정,교육
"석굴암 안에 불상의 아름다움에도 감탄을 하지만 가는 길, 풍경, 전망 등도 너무 좋아서 가벼운 등산 코스로도 추천한다.",관덕정,교육
옛모습그대로 복원지 않아 아쉽습니다. 이 대단한 우리의 유산을 망가뜨린 일본이 밉습니다. 우리의 아이들에게는 그 아름답고 찬란했던 모습 그대로를 보여줄수 있었으면 좋겠습니다.,관덕정,교육
가는 길이 너무 예쁘고 특히 새벽에 갈경우 공기가 맑아서 좋아요. 한시간이면 충분하고 숙소가 많은 곳에서 그닥 멀지 않음,관덕정,교육
불국사와 더불어 신라를 대표하는 문화재입니다. 최근에는 일제시대의 잔해를 치우고 고유의 모습을 되찾는 복원작업을 하는 것으로 알고 있습니다.,관덕정,교육
입구에서 산 길을 따라 산책하듯 조금 걸어가야 만날 수 있습니다. 석굴암 보존을 위해 유리창 너머로 볼 수 있습니다. 자연 속에 자리한 석굴암의 모습을 가까이서 볼 수 있어 좋습니다. 석굴암 자체도 멋있지만 석굴암을 등지고 보여지는 산의 풍경 역시 매우 아름답습니다,관덕정,교육
불상의 크기가 생각했던 것 보다는 좀 작아서 의외였지만 불상을 둘러싼 돔형의 암석들과 조각들이 신비했습니다~ 들어가볼수는 없어서 유리창너머로 보아서 조금 아쉬웠어요~ 석굴암에 나와 바라보는 경치도 아주 멋지답니다~,관덕정,교육
예전 초등학교 시절 수학여행으로 경주를 방문했을 때는 온전한 부처석상을 볼 수 있었으나 문화재 보존 차원에서 지금은 유리관에 갇힌 부처석상을 만나볼 수 밖에 없는 곳. 하지만 언제보아도 인자한 부처석상의 얼굴을 보고 있자면 마음의 평안를 얻기에 충분하다.,관덕정,교육
"모두들 한번쯤은 가보셔도 됩니다.
대표 유적지이기도 하며 경주 투어 필수이기도 합니다.
추천합니다.",관덕정,교육
"석굴암 입구에 들어서면 소원을 비는 종
타종식도 해보시구요
석굴암에 들어서면 아름다운 부처의 불상이 한눈에 들어옵니다
또하나 빼놓을수없는것이 석굴암의 산 정상에 올라가시면 아름다운 철쭉의
자태를 감상하실수있으니 빼먹지 마시길 ~~",관덕정,교육
토함산에 위치한 대표적인 석굴사찰이다. 김대성이 전생의 부모를 위해 만든것으로 알려져있으며 유네스코세계문화유산이다.,관덕정,교육
신라인들의 숨결이 느껴집니다.,관덕정,교육
"석굴암은 경주의 수많은 문화재들 중에서도 단연 최고라고 생각합니다.
현대 과학으로도 할 수 없는 일들을 신라인들이 했다는 사실이 너무나 놀랍고 경이롭지만....
일제의 만행으로 인해 가슴이 많이 아픕니다..

석굴암앞에서 마주보이는 동해바다의 모습이 아름답습니다.",관덕정,교육
"불국사에 들러서 석굴암까지 가는데, 셔틀버스도 많지 않고 일찍 끊긴다. 또 올라가는 길이 굴곡져서 어린이들이 가기에 조금 힘든 코스이다. 하지만 교과서에서 보았던 곳을 실제로 가본다는 것에 의의가 깊다.",관덕정,교육
"몇년마다 석굴암을 갔는데, 갈때마다 점점 변하고 있음. 점점 가림막이 많아져서, 이제는 사진으로보는것보다 못함. 입장료도 비싸고, 길을 따라서 한참을 걸어서가서, 유리벽이 2중으로 쳐져서 잘보이지도 않는 부처상을 슬쩍 눈도장만 찍고 와야함. 대표유물이어서 가봐야 하지만, 사실 볼게 없음...",관덕정,교육
"석굴암은 거리는 동떨어져 있지만, 택시를 타고 가볼만한 곳입니다. 산책로를 따라서 갈 수도 있고 버스도 운행하고 있습니다. 다만 버스 시간이 가끔 있으니 잘 맞춰서 가야합니다.",관덕정,교육
"우리나라사람이라면 모르는 사람이 없늠 대표적 유물. 보수 공사를 잘못하여 원래의 신비스러움은 많이 훼손되었지만, 그래도 한국인이라면 꼭 가봐야될 곳.",관덕정,교육
"언제나, 석굴암에 가는 길은 멀고도 굽이굽이라 힘겹지만,
그 안에 들어서는 순간 뭔가 응집된 것이 풀리는 그런 기분이랄까..
안타깝게도 유리벽 안에 갇혀있는 모습을 볼 수 밖에 없지만
조상님들의 위대함을 한껏 마음에 품고 올 수 있어요!",관덕정,교육
"토암산 기슭에 있는 석굴암은 불국사를 방문하시고
올라오시는 방법과 주차장까지 차로 오시는 방법이 있습니다.
그리고 신라시대의 예술을 느낄수 있는 문화재 입니다.",관덕정,교육
"이번에는 한낮에 올라갔는데, 석굴암은 새벽에 가서 일출봤던 때가 제일 좋았어요. 아침 일찍 가는거 추천합니다.",관덕정,교육
"석굴암은 아침 7시부터 오픈한다! 하지만 석굴암 까지 가는 버스는 8시 40분부터 불국사에서 출발함으로 시간 맞춰 오시면 좋지만 그럼 사람이 많이 붐비기 때문에 잘 결정하길 바란다! 가는 길은 대관령과 같이 매우 구불구불하다. 석굴암에 오르면 저 멀리 동해바다가 보이며 감탄을 할 것이다! 석굴암의 신비, 석가모니의 아름다움! 가까이에서 볼 수 없어 매우 아쉬웠지만 그래도 정말 멋진 곳이라고 자부할 수 있다.",관덕정,교육
"아이와 첫 경주 여행.. 아이가 가장 보고싶어 하던 자옷가 석굴암이었어요. 20여년전에 봤던 신비한 석굴암.. 여전히 신비함이 있습니다. 경주하면 석굴암, 불국사는 꼭!!!!!",관덕정,교육
"수학여행때나 가보는 석굴암.
올라가는 길에 그렇게 많은 식당들이 있는줄 몰랐네요. 먹거리가 많은 곳이었어요. 내려서 바로 석굴암이 있었던 기억이었는데 그게 아니더라구요. 주차장에서부터 꽤 걸어서 석굴암 까지 가야 하는데 길이 그렇게 수월하지는 않았어요. 운동화는 필수일듯 합니다. 사람이 많았다 적었다 하는 길들을 지나 석굴암에 도착.
와....
이런걸 그 옛날에 만들었다니 하는 감탄이 절로 나옵니다.
불교 신자들은 뭔가 다른 느낌을 더 받을것 같다는 생각이 들더라구요.
아름답고 ... 신기하고~",관덕정,교육
"이곳에 오지 않고 어떻게 경주를 봤다고 할 수 있겠어요.
종교가 무엇이든 간에 석굴암은 너무나 아름답고 대단한 유산입니다.",관덕정,교육
석굴암 안의 본존불은 유리관 밖에서만 볼 수 있고 일년에 한번만 안에 들어가 볼 수 있다고 합니다. 절처럼 지어진 곳 안에 들어가야 유리벽 안의 본존불을 볼 수 있습니다,관덕정,교육
"엄청난 작품이고 또 해설사 분이 설명을 해주고 계셔서 좋았습니다.
일제에서 해체를 한 것을 다시 복원하는 과정에서 시멘트를 이용해 습기가 찬다는 사실은 참 아쉬운 것 같습니다.",관덕정,교육
"석굴암을 자세히 볼 수가 없어서 좀 아쉽습니다,
보존을 위해 어쩔 수 없겠지만 더 잘 볼 수 있었으면 합니다.",관덕정,교육
"석굴암이 너무 많은 시설물에 의해 꽁꽁감추어져 있어서 내부를
아주 일부만 그것도 잛은시간에 보고 지나가야해서 아쉬움",관덕정,교육
석굴암이 위치한 토함산 중턱에 주차장이 있어서 그곳부터 10분정도 걸어갔는데 가을이라서 참 좋았어요. 석굴암이 보수 공사중이라서 잘 볼수 있을까 염려를 했었는데 유리벽을 사이에 두고 본존불과 그를 중심으로 대칭 구조를 이루고 있는 석굴의 모습을 잘 볼수 있어서 다행이었어요. 그 옛날에 산 속으로 무거운 화강암을 운반하여 어떻게 이런 아름다운 조각을 하였는지!,관덕정,교육
"봄을 맞아 경주를 찾았습니다. 차로 한참 동안 산을 타고 올라가서 주차를 한 뒤에 또 다시 10분 가량을 걸어야 석굴암을 마주할 수 있었습니다. 유리에 갇혀있는데다가 둘러싸고 있는 건물이 공사중이라 전부 덮혀있어 제대로 느끼기에는 부족했지만, 유리 안의 부처님 모습은 정말 평화롭고 온화해 보였습니다.",관덕정,교육
하나의 석굴 안에 요약된 팔만대장경 <석굴암>,관덕정,교육
"석굴암과 불국사, 경주하면 의무코스와도 같은 곳, 아무리 수십 번 갔던 곳이라도 저도 모르게 발길이 이어진다. 신라시대의 유구한 역사와 문화, 조상들의 숨과 얼이 여전히 살아 숨 쉬고 있다.


▶ 석굴암
신라 경덕왕 10년에 김대성이 전생의 부모를 위해 창건하기 시작하여 774년 혜공왕 때 완공한 석굴사원으로 건립 당시의 명칭은 석불사였다. ""돌로 비단을 짜듯 감실을 조성했다.""는 옛 기록이 말해주듯 거친 화강암으로 부드럽고 아름다운 부처님의 모습을 표현한 것으로 통일신라 불교미술의 백미라 할 수 있다.


석굴암을 가려면 버스 시간부터 확인해야 한다. 물론 숲길을 따라 등산을 해도 좋으나 소요시간 약 한 시간, 시간이 여의치 않다면 버스를 이용하는 것이 효율적이다. 불국사 관광정보센터 길 건너 버스 정류장에서 시간마다 운행한다.",관덕정,교육
"신라시대 불교미의 극치, 유리너머로 봐야 한다는 게 아쉽다.",관덕정,교육
"불국사랑 세트로 꼭 보고 싶은 세계유산입니다. 불국사에서 도보로 1시간 이상 걸립니다만, 산길을 오르는 거라 관광안내소 앞의 도로를 사이에 둔 건너편 버스정류장에서 12번 셔틀버스 타는 게 편리합니다. 단, 1시간에 1대 운행이라 계획 잘 세우세요. 다음 버스정류장이 불국사 입구에서 가까우니 여기서 타는 것이 좋습니다.
종점 주차장에서 목적지까지 평지로 도보 15분 정도. 불국사 하나만 보면 되기 때문에 다음에 하산하는 버스 시각까지 충분히 감상할 수 있습니다.
우선 그 아름다움과 정교함, 치밀함에 숨이 멎습니다. 그만큼 반사광때문에 세부상태를 선명하게 볼 수 없는 유리너머로 감상해야 한다는 점이 안타깝습니다. 도쿄국립박물관에서 쓰고 있는 저반사, 고투과 유리로 빨리 교체하면 좋겠습니다.",관덕정,교육
아침 일출을 보로 가면 아주 좋음. 높은 곳에 위치해 있고 시원함. 석굴암은 작지만 주변 전경을 즐기거나 새벽같이 일출보러 가시길,관덕정,교육
"751년에 창건되었지만, 파묻혀있던 것을, 1909년에 집배원이 우연히 발견했다던가. 전날에 내리던 비는 그쳤지만, 아직 석굴암 주변은 안개가 끼어, 기대하고 있던 주차장에서 보이는 멋진 풍경은 안타깝게도 볼 수 없었습니다. 주차장에서 조금 걸어, 석가여래 좌상 앞에 섰습니다. 아침 7시 반이었기에 아직 아무도 없어, 독점할 수 있는 상황이었습니다. 높이 3.48m라 그렇게 크지는 않았지만, 뭐라 형언할 수 없는 표정. 꺼림칙한 마음을 품은 자에겐 화를 내는 듯하고, 올곧은 마음을 품은 자에겐 웃고 있는 것처럼 보이는 듯합니다. 불상이란 정말 마음이 치유되네요. 부산·경주 여행의 하이라이트입니다.",관덕정,교육
꼭 방문해야 할 곳입니다! 길고 구불 구불 한 길에도 불구하고 여전히 방문 할 가치가 있습니다. 정상에서 바라본 경치는 너무나 아름답고 평온을 원하는 사람들에게 좋은 곳입니다.,관덕정,교육
"산에서의보기는 훌륭하다. 그러나 우리가 사원에 도착했을 때 우리는 그림을 가져갈 수 없었다. 그것은 숭배의 장소 다 나는 얻는다. 그러나 또한 역사의 여행자의 끌어 당김이다. 그리고 우리는 우리가 우리 하이킹을 시작하기 전에 그것을 최소한 언급해야했다. (약간의 과장, 그것은 단지 분이지만 아직도)",관덕정,교육
장엄한 역사 문화 공원 교육적인 체험도 굿,관덕정,교육
