투명카약을 타러 갔지만 안전상의 이유로 영업이 종료 되었다는 정보를 접하고 아쉬웠지만 짧게 해변 산책으로 쇠소깍을 둘러보다.,쇠소깍,자연
바닷물과 민물이 만나 에메랄드빛으로 반짝이는 쇠소깍 풍경 너무 아름답습니다,쇠소깍,자연
처음으로 제주아이랜드를 혼자 첫 여행 해 봤어여 깨끗한 바다와 자연을 보며 답답한 일상에서 벗어나 여유가 있고 자유로운 곳에서 답답했던 마음을 속 시원하게 뻥 뚫어 버렸죠 ! 다음에도 꼭 가고 싶어요,쇠소깍,자연
날씨도 좋고 풍경도 좋았던 쇠소깍,쇠소깍,자연
"이곳은 바다와 강물이 만난다고하는 쇠소깍입니다
멋진해변과 멋진 둘레길을 둘다갖춰서 데이트코스로 딱!
투명카악도 재미있으니 꼭 타보시길요",쇠소깍,자연
"사람이 너무 많아서 투명카약도전은 실패했지만 
이렇게 멋진 풍경을 담아 가요 ",쇠소깍,자연
"저희가족 첫여행지는 제주도 였어요
처음으로 간 제주도엔 볼거리도 많고 맛난 음식도 많아서 정말 행복했답니다.
쇠소깍 해녀동상을 보고 따라하는 저희딸 ",쇠소깍,자연
우선 좋은것은. 주차장과 해변이 매우 가까운것. 하지만 무법차로 약간 무서움. 그러나 파라솔 영업하시는분들의 다닥다닥 파라솔덕분에 앉을자리가 부족하고. 조개껍질사이로 유리변들이 깨져있어서 아이들걱정에 청소 했다는거. 게다가 추워서 온수샤워장에 들어가는데. 현금만 내는 시스템은 좋지만. 아무도 열체크나 이름이나 인적사항을 안적는거. 아놔. 제주도가 아니면 금능해수욕장이 둘중 어디가 어이없는건지. 약간 두려움에 떨면서 후딱하고 나왔다는거. 개무섭.,쇠소깍,자연
"바닷가는 더없이 좋았으나 파라솔 빌려주며 자릿세 받는 영업자들 최악입니다. 코로나땜에 자리를 띄워서 넉넉히 파라솔 설치한것까지 이해하겠는데, 그런식으로 전체 백사장을 점령해버리면, 파라솔 구매 안하는 관광객은 어디 앉으라는건가요? 구매하고 싶어도 대기가 너무 길다고 돌려보내놓고. 빈자리 찾아서 겨우 앉으면 본인들이 꽂아놓은 파라솔에서 가깝다고 비키라고 하고. 대체 빈자리가 없는데 어디에 앉으라구요. 파라솔 이용 안하는 사람은 금능해수욕장 못옵니까? 특히 하늘색 파라솔 사방에 꽂아놓고 영업하던 업체분! 좀 양심적으로 공간 봐가면서 영업하세요. 신고하려다가 참았습니다. 방문하시는분들 참고하세요. 파라솔 못 빌리면 앉을데도 없습니다.",쇠소깍,자연
제주한달살기 왔다가 두달을 살게되었어요 그와중에 제주에서 예쁜 아가야도 생기게 되었구요 제주에서의 생활을 정리하며 인생사진 한장 남기고 가자 생각하며 피크닉세트 대여하고 금능해수욕장에서 이쁜사진 남기고 갑니다,금능해수욕장,자연
바닷가에서 노을을 감상했다.,금능해수욕장,자연
태풍이 지나간 후 청명한 가을의 공기가 너무 좋네요. 구름사이로 빛내림과 용이 승천하는 듯한. 바다색도 너무 아름답고 상쾌합니다. 제주는 언제나 와도 늘 그렇듯이. 제주살이.제주도민 좋다.~,금능해수욕장,자연
친구와 함께 간 여행~ 제주도는 카메라에 담기는 모든 풍경이 예술이었다.,금능해수욕장,자연
아이와 함께 시원하고 푸른 바다가 보이는 곳으로~ 청량함이 시원하다~,금능해수욕장,자연
"바다를 바라보며 달리는 일은정말이지 가슴이 벅차올라요

여름 제주 제주서쪽 금능 조깅 달리미",금능해수욕장,자연
협재 해수욕장 옆인데 애들과 같이 놀기에는 좋은거 같아요 어쩜 간조따 갔는데 완전 고둥? 에 게에 돌들이 좀 있어 고기도 보이고 애들과 같이온 가족은 좋아요 ! 거기 관리 하시는분도 화장실도 깨끗하게 관리해주시고 샤워실도 친절하시고 휴세고 직원도 짜증안내고 좋으시더라구요 전에 간 김녕은 .관지 직원이 퉁명스럽고 샤워실관리도  다음번 전 여기 또 옵니다,금능해수욕장,자연
여행 여름 금능으뜸원해변 금능해수욕장 금능 제주여행 유명한 협재해수욕장 바로옆에 위치한 금능으뜸원해변. 너무나 아름답고 조용한 해변이랍니다물이 얕아 아이들과 물놀이하기 너무 좋고상업시설이 많지않고 야자수나무가 울창해 외국에 온듯 너무나 좋은곳이랍니다이번 이른 여름 휴가로 아이와 단둘이 찾은 금능으뜸원해변 너무나 행복한시간을 보내고있답니다,금능해수욕장,자연
금능해수욕장은 제가 제주와서 처음 바라본 바다네요. 제가 있었던 곳과 가장 가까워서 운전 처음 연습겸 갔었는데 제주바람이 강력해서 사진 한장찍고 바라보고 말았네요. 그래도 제주 여행의 처음과 끝을 보냈던 곳이라 기억에 남네요. 한림쪽 가까워서 좋았어요,금능해수욕장,자연
"아름다운 바다빛에 여름 수영할수 있을때 꼭 다시 오자고 아이들과 약속했답니다.
바라만보고 있어도 힐링되는곳 짱이었습니다.",금능해수욕장,자연
"학기 중 즉흥으로 떠난 제주여행. 10년만에 가보는 제주도가는길은 너무 떨렸다. 뚜벅이 여행이라 제주도 도착 후 숙소 까지 가는 길이 너무 힘들어 지쳤있을 때 우연히 만난 금능해변. 힘들었던 기억, 배고픈 기억은 모두 잊고 신나게 사진 찍으며 놀았다. 낮에 도착해서 해가 질 때 까지 그냥 바다만 바라본듯하다. 지금까지 본 바다중 정말 가장 예쁘고 가장 기억에 남는 장소이다. 제주여행을 간다면 다시 한번 가고 싶다.",금능해수욕장,자연
"도민이지만 즐겨찾는곳~
물빠진 해변이 너무 아름답고 멀리 보이는 비양도와 함께 사진찍으면 굿굿",금능해수욕장,자연
제주가을금능썰물비양도제주서쪽일몰,금능해수욕장,자연
제주가을 혼자만의 여행 추억을 남기고싶어서.마음만은 제주 홍보대사입니다,금능해수욕장,자연
금능해수욕장 유학생여자친구와 군인남자친구의 여행 반년만에 만나서 행복했어요 셀프스냅,금능해수욕장,자연
"제주시 한림읍 금릉리금릉해수욕장블루하와이리조트
태풍 노루가 북상하기 전에 도착해서 날씨도 아주 좋고 푸른 바다를 맘껏 느낄 수 있었어요. 사진은 금능리 블루하와이리조트에서 찍었어요. 바다의 푸른 빛과 풍력 발전소가 정말 청정 제주와 아주 잘 어우러진 멋진 풍경이죠? 실제로 숙소에서 신재생에너지로 다 전력을 공급하고 있었어요. 제주도 한림읍 금능리 꼭 와보세요 !",금능해수욕장,자연
"비양도 품은 맑고 투명한 바다
금능해수욕장

언제 어디서나 그리운 제주의 바다
그중에서 가장 그립고 가고싶은곳.",금능해수욕장,자연
금능바다 현무암에 앉아 석양을 감상했습니다. 아름다운 석양을 배경으로 사진을 찍는 예비부부와 연인들이 많았습니다. 해가 들어간 후 붉은빛이 바다에 그대로 비치며 오묘한여러가지 색으로 빛났습니다. 말 그대로 으뜸의 풍경을 보여주는 금능해변입니다.,금능해수욕장,자연
"금능으뜸원해변
새하얀 모래와 에메랄드빛 바다가 있는 곳입니다. 수심이 낮고 물이 맑아 아이들과 함께하기에 더없이 좋습니다. 멀리 작은 섬 비양도가 보이는 풍경이 아주 아름답습니다. 낮에는 물이 빠져 놀기에 좋고 저녁에는 물이 찹니다.",금능해수욕장,자연
"금능해변야영장 백패킹 캠핑 남자들만의여행 늑대캠
금능해변 에서 마시는 커피한잔의 즐거움이 좋더군요
한림 비양도 가 보이는 바닷가 풍경 참 멋진 곳입니다",금능해수욕장,자연
"마치 해외같은 맑고투명한 제주해변
퐁당퐁당 조금이른 여름을 맞이해본다.",금능해수욕장,자연
금능해수욕장 제주도스냅 제주도우정여행 제주바다,금능해수욕장,자연
"정말 맑은 바다 와 비양도 를 함께 볼 수 있는 금능으뜸원해변
기분이 좋다.",금능해수욕장,자연
"리얼모래놀이 유튜브안녕 제주도의푸른모래 금능해변에서놀기 겨울바다 4살인생겨울바다 문예린이바다놀이

제주 금능으뜸원해변 모래사장에서 아이와함께 모래놀이 할 수 있어서 정말 행복했습니다 도시에 놀이터는 이제는 모래를 찾을수없어 아쉽네요 자연과 함께 자라는 제주도가 정말 좋습니다",금능해수욕장,자연
"사계절 모습이 다 다른 제주의 해변!
같은 계절 안에서도 날씨에 따라 그 모습이 또 달라져요.
구름과 바닷물의 색과 모래알의 색이 오묘한
금능 해변!",금능해수욕장,자연
"협재리에서부터 천천히 걸어 도착한 금능해변
날이 흐렸음에도 삼삼오오 가족들과 함께 여행온 사람들이 많았던 장소",금능해수욕장,자연
해저문 금능해변의 전깃줄에 걸린 한치마저 예쁜 여름. 제주. 밤.,금능해수욕장,자연
"협재보다 살짝 밑에있는 금능해변.
사실 여기까지도 협재해수욕장이인줄 알고 멈췄었지만 
물과 모래들로 세상에서 가장 행복해보이는 아이들만 구경하고 있었는데 시간이 훌쩍 지나가더라구요.",금능해수욕장,자연
바다는 자연이 주는 아름다운곳~,금능해수욕장,자연
"금능으뜸해변도 좋은데, 금능석물원 맞은편에 있는 해변도 정말 예뻐요 ",금능해수욕장,자연
고운 모래가 있는 금능해변. 정말 아름다운 곳,금능해수욕장,자연
금능에서 해녀와 비양도를 배경으로 찍었습니다,금능해수욕장,자연
협재와 인접한 금능으뜸해변의 아름다은 모습,금능해수욕장,자연
친구들과 함께 떠났다가 홀로 며칠 더 머물렀던 금능해변에서삼각대세워놓고 혼자서 폴짝,금능해수욕장,자연
"금능석물원을 둘러보고 금능해변에서 해넘이를 보았는데,시시각각 변하는 바다빛깔이 참 아름다웠어요",금능해수욕장,자연
"제주 여행 중 가장 황홀했던 순간.
해수욕하러 바다에 갔더니. 일몰보고 취해 하룻밤 더 청하게 되었다.",금능해수욕장,자연
개인적으로 제주도에서 가장 예쁜거같은 금능해변,금능해수욕장,자연
"도민이지만 처음가본 금능해변.
아이들과도 놀기좋고 바다색도 죽이고
아이들도 즐거워해서 더할나위없이 즐기다왔어요",금능해수욕장,자연
9월 마지막주의 애월해안도로. 햇빛이 비춰서 더 예뻤던 바다빛 다시 제주의 바다가 보고싶어져요. 제주의 바다는 감동입니다,금능해수욕장,자연
가족과 같이 간 제주에서 멋진 석양을 함께 맞이했네요,금능해수욕장,자연
제주동부 투어를 하며 제주만의 분위기가 묻어나는 카페와 뒷편에 유채꽃밭까지 일석이조로 즐길수 있었습니다. 제주만의 매력을 느낄수있는 해안도로 중에서 일몰이 아름다운 애월해안도로를 가장 좋아하는데 언제봐도 아름답지만 이날은 유독 주황색의 짙은 노을 이였습니다. 소금바치순이네에서 저녁을 먹고 맞은편에 보이는 산책로에서는 흐렸지만 우도로 추정되는 섬도 보이는 제주만의 뷰를 느낄수 있었습니다. 언제와도 너무 좋고 좋은 추억을 남길수 있어서 행복했습니다!,애월해안도로,자연
"애월해안도로를 산책하던 중 만난 노을~~너무 멋져 연신 셔터를 눌렀는데 신기하게도 그 찰나의 순간에 지나가는 누군가.해안도로 다락쉼터, 애월항, 구엄포구에서 산책하며 촬영한 사진입니다",애월해안도로,자연
제주 제주애월읍 애월해안도로 엄마랑딸여행하기 겨울입구의제주 비오는제주밤 힐링여행 밤하늘신비함 멀리고등어잡이배만선기원,애월해안도로,자연
애월해안도로 에서 만날 수 있는 홍스팜 푸드트럭제주도에서 가장 예쁜 애월해안가에 자리해아름다운 바다 보면서 부들부들한 수플레 케이크 먹는 재미 꺄~~상상 이상의 맛을 느끼실 수 있어요.간단한 브런치 로 즐기시기 참 좋습니다!여름,애월해안도로,자연
"해안 도로 입구로 들어선 뒤 보이는 뷰가 매우 훌륭함. 오후 6시쯤 해가 어느정도 떨어져갈 때 쯤 들어갔는데 일몰과 함께 보이는 탁트인 바다, 시야의 왼편으로 보이는 구불구불한 절벽들이 조화를 이룸. 내려서 보기보다는 이동중에 보이는 풍경들이 더 아름다움.",애월해안도로,자연
애월 바다를 차로 달리며 바라보았던 곳이네요. 제주도 운전이 익숙하지 않아 어려웠지만 애월 카페와 캔들가게를 가기위해 달렸던 곳! 육지에서는 바다를 보며 운전할수가 없었는데 바다를 보며 운전을 하는 것은 참 즐거운 경험이었습니다.,애월해안도로,자연
"애월해안도로는 하귀애월해안도로라고도 한다. 경관이 빼어나서 드라이브코스나 하절기 일몰조망으로도 유명하다. 해안 곳곳에 카페와 펜션들이 있다.
애월해안도로 하귀애월해안도로 드라이브코스 경치좋은곳",애월해안도로,자연
여행 제주여행 제주맛집 데이트 드라이브 제주인 제주호텔 제이드림호텔 즐거운 여행,애월해안도로,자연
자동차로 달리다 예쁘게생긴곳이면 옆에 차대고 내려서 사진찍고 또내려서 사진찍고했던 곳이었어요~ 그냥 차로달리기만해도 힐링이되는 정말 스트레스가 없어졌었어요~~ 꼭가보세요~~~,애월해안도로,자연
일부러 석양질때쯤 까페에서 나와서 달렸던 도로에요. 아무 곳이나 차 댈수있는데 대놓고 사진찍으면 하늘이 파스텔톤으로 장난아니더라구여  중간중간 쉼터있어서 그런데서 노을일몰 보시는 분들도 많아요!,애월해안도로,자연
"어는덧 중년이 되어버린 울 부부~!
애월 해안길이 평생을 함께하고픈 맘 으로
사진을 담아봅니다.울 가족들은 현재와 미래 그리고 과거를 아스란히 ~
울 식구들 행복과 건강이 아스란히 보여지는듯 하네요~.",애월해안도로,자연
애월 해안도로는 드라이브 코스로 딱이죠~ 바로 옆에 바다를 끼고 달리면 기분 최고!,애월해안도로,자연
해안도로 드라이브 갈때마다 가슴이 시원하게 뻥 뚤리는것같아여,애월해안도로,자연
"제주바다바다애월해안도로맑고돌이특이해느낌있는제주
돌사이에 게와거북손이아주많음청정제주",애월해안도로,자연
"해안가를 따라 있는 바다가 이쁜 애월 해안, 더럭분교를 들려서 도착했어요- 쇠소깍에만 카약 있는 줄 알았는데 여기도 있네요~
타보고 싶었지만 아쉬움을 뒤로하고 사진으로 담아두었습니다. 엄마와도 이쁜 해안을 배경으로 찰칵했어요",애월해안도로,자연
애월해안도로 날씨좋은날 맑은제주 제주바다 바당,애월해안도로,자연
"애월해안도로 리치망고 지나면 잇섬 이라고 ~
샌드위치 맛나네요",애월해안도로,자연
"애월해안도로 신엄리 애월 푸드트럭 에이비트럭
애월해안도로에 있는 푸드트럭이에요. 인스타그램에서 하염 없이 입맛만 다시다가 이번에 직접 다녀왔는데 역시나 엄청난 맛 맛있어요 가보세요~",애월해안도로,자연
"애월 밤바다 게스트하우스 주변이 온통 애월해안도로 였다. 한치잡이배 아저씨들이 한치를 마구 잡아오셔서, 한입 얻어먹었다. 청하 한 병에 한치 는 꿀 조합. 최고의 밤이었던 제주도 에서의 첫밤",애월해안도로,자연
"제주하면유채밭 제주유채꽃 유채밭 노을질때 애월해안도로

제주도의 여행의 묘미는 해안도로를 달리는거라고 생각 해서 네비가 안내해주는길이 아닌 바다를 찾아 둘러보던 중.유채 단지라고 하기엔 너무 작고 그렇다고 아니라고 하기에도 너무 많은 양의 유채들!사람 없이 여유로운 이 유채밭을 보니 사진을 찍지 아니할수 없었죠 유명한 관광지가 아니다 보니 찾는길이 애매할 수 있으나 근처에 펜션그린하트라는 숙소가 있어서 혹시 나중에 찾아가실분들이 있다면 참고하시면 좋을것 같아요 매년 봄에 항상 유채꽃을 보러 이 곳으로 가게 된답니다 ",애월해안도로,자연
"애월 지디카페 멘도롱또똣 한담해변 카페봄날
아름다운 한담해변. 지디카페, 카페봄날 등의 예쁜 카페들이 많아 마음의 휴식을 취할수 있는곳이다.",애월해안도로,자연
"제주도의 예쁜 카페는 여기 다 모였다! 애월
제주도 오기 전에도 기대를 많이 했던, 애월!
기대한만큼 너무나도 아름다운 바다와,
예쁘게 꾸며진 카페들이 눈을 즐겁게 했어요!
조금 더 가면 나오는 협재 해수욕장도 애매랄드빛 바닷물에 가을임에도 불구하고 들어가서 놀고 싶은 마음을 참느라 정말 힘들었었어요 ",애월해안도로,자연
에메랄드빛바다마음과눈이쉬어가는곳날씨좋은날생각나는푸르던애월봄날그리고해안산책로생각정리에도마음정리에도애월사랑하는사람과걷고싶다,애월해안도로,자연
"제주바다 너무 예뻐요 이바다 또 보고파서
제주 여행 또 계획중입니다
예쁜바다와 즐거운 먹거리로 행복한제주",애월해안도로,자연
애월해안도로 가족여행 겨울바다 맑은하늘 행복한미소 제주도 제주도에빠지다제주도이벤트 제주도여행공유,애월해안도로,자연
애월읍 해안도로 드라이브중 멋진파도와 함께.,애월해안도로,자연
"애월해안도로 지나다 차를 멈추고 찍었어요
애월쪽 너무 예쁜 바다 그리고 하늘사진 한장
제주도 바다 역시 최고예요",애월해안도로,자연
몽상드애월 뷰가 끝내줍니다아,애월해안도로,자연
애월길을 걷다가 풍경이 넘 예뻐서 찍어본 갈대밭이랑 바다에요 ! 바다가 예뻐보인다고 생각한 적이 없는데 처음으로 너무 이쁘더라구요 ,애월해안도로,자연
애월해안도로 애월읍 여행 추억 12월,애월해안도로,자연
제주 겨울제주 겨울바다 일몰 꿈같은제주바다 애월 제주서부 석양 한담,애월해안도로,자연
장한철 산책로에서의 눈부시게 아름다운 해넘이,애월해안도로,자연
눈부시게 아름다운 애월한담 장한철 산책로에서,애월해안도로,자연
"애월 해안도로에서 일몰 시간, 아내와 함께 바라본 일몰입니다.",애월해안도로,자연
"애월의 해안도로따라 이리저리 다니다 발견한곳~~
바로앞에 지금 이순간 카페도 쵝오에요",애월해안도로,자연
봄날카페에서 바다를 벗삼아 차한잔을.,애월해안도로,자연
바다가 보이는 달자(바다를 달리는 자전거) .앉은뱅이 붉은 쇼파에. 앉아 탁트인 바다를 바라본것만으로도 쉼이 되었던,애월해안도로,자연
"애월읍 해안도로 카페에 앉아서
황금빛으로 물들어가는 제주도를 바라봅니다
빛내림과 빛오름이 예술이네요",애월해안도로,자연
애월해안도로를 따라가다 아무렇게나 내려 찍은 곳.,애월해안도로,자연
"드라이브하기 좋은 애월해안도로 
날씨가 너무 좋아서 그림 그 자체였던 해안도로 드라이브",애월해안도로,자연
"애월해안도로는
넘실대는 파도와 깍아내리는 절벽이 이어져 있어요.
넋놓고 파도가 바위에 부셔지는 모습만 봐도
마음은 힐링이됩니다",애월해안도로,자연
"제주도 애월의 아름다운 카페 봄날 에서 찍은 아름다운 석양
또 가고 싶네요",애월해안도로,자연
가을 저녁 가족들과 함께한 곽지해수욕장의 석양~ 우연히 보게된 아름다운 노을빛,애월해안도로,자연
도민으로써 오랬만에 간 곽지해수욕장. 좀 짜증나드라구요~ 파라솔대여비 2만원내고 빌렸는데 튜브바람담을려니 옆 천막으로가서 담으로하는데 말도 안통하는 동남아사람들이 튜브보고 바람담는데 5천원 또 받드라구요~ 통상 타 해수욕장은 파라솔빌리면 무상으로 그자리서 해주던데 거기다 튜브 바람만 담는데 금액도 5천원 뭡니까??? 파라솔 안빌려도 2천원 정도만 받던데 태반인데 금액자체가 좀 말도 안돼게 바가지쓴거같아 짜증이나드라구요~ 그것도 버젓히 옆 안내판에는 바가지근절 써있던데 말도 안통하는 동남아인들3명이 금액만 말해대고 그 상황이 도민인데도 어이가 없어요 종합상황실앞 모래사장 파라솔대여 2만원써진 폴대옆 천막입니다. 이런식으로 한철장사다 뭐다 하지마세요~ 남들은 1년 열심히 일해서 돈법니다.,애월해안도로,자연
푸른 바다와가을 하늘의 어울림으로 절로 힐링이 되는 곳이네요,곽지해수욕장,자연
"맛집을 둘러보기보다 제주의 가을정취를 맛보러 갔던 힐링여행.무엇보다 맘이 맞는 지인과 같이 둘러볼 수 있었던 것이 여행의 만족도를 높여줌.
제주는 갈때마다 새로운 희망을 느낄 수 있는 곳이다.",곽지해수욕장,자연
"목포에 살고있어 제주를 자주 오는데도, 꼭 한번 해보고싶었던 제주살이. 아이들 여름방학으로 3주간 계획. 올해 드디어 실행에 옮기다~ 서울에서 며칠 오신 친정엄마까지 행복한 웃음을 웃게하는 제주 제주야~ 올여름 잘부탁해~~~

제주살이 2018여름 곽지해수욕장 딸셋 여름바다",곽지해수욕장,자연
"곽지해수욕장
물놀이 재밌당~
놀이터도 있고 분수대도 있고 노천탕도 있는 곽지 해수욕장은 심심할 틈이 없어요",곽지해수욕장,자연
제주도 여름 제주여행 곽지해수욕장 바다 제주바다 친구들과 우정여행 즐거움 행복 힐링,곽지해수욕장,자연
"오늘 처음 왔어요
그런데 노천탕에는 쓰레기와 담배꽁초가 많아 들어가고 싶지 않네요
특히 입구에 개똥이 한두무더기 있어서 실망
해변에도 개들이 있어서 영 찝찝합니다
그런데 물은 좋아요 깨끗합니다 용천수가 있는것같은데 넘 시원해요
결국 이좋은 해변을 관리만 잘하면 참 좋을텐데
특히 담배피는거 애완동물 이런거 통제를 좀 해 주었으면하네요",곽지해수욕장,자연
"겨울이어서 추웠지만 바다는 참 예뻤어요. 다만 노천탕은 관리가 전혀 안되있어서 물에 쓰레기가 떠있었어요.
막 기대는 하지마세요 일몰도 잘 안 보입니다!",곽지해수욕장,자연
곽지는 해녀상 같은게 제일 기억에 남네요. 그리고 현무암인지.? 그 돌들과 바다와 바람이 어우러지는 곳이었던걸로 기억나요! 여름에 가면 입구 바로 나와서 탕처럼 들어갈 수 있다는데 전 가을에서 겨울 넘어가는 사이에 가서 구경만했네요 그래도 제주바다는 어디나 너무 예뻐서 좋아요 곽지도 푸른바다가 정말 좋았어요,곽지해수욕장,자연
"넓고 완만한 경사로 여름철에는 인기가 많은 해변이다. 과물노천탕도 있다.
곽지해수욕장",곽지해수욕장,자연
공항에 가기 전에 잠시 들렀습니다. 알아보고 들른게 아니어서 노천탕을 보고 깜짝 놀랐네요. 여름에 오면 정말 좋겠다고 생각했어요.,곽지해수욕장,자연
애월쪽 숙소로 한달살이를 하는 동안 아이들과 매일 곽지해수욕장을 갔었네요. 한여름 더위도 바다에서 놀땐 전혀 문제도 안되고. 용천수가 있는 노천탕은 얼음물이라 아이들도 깜놀. 바닷물빛도 노을빛도 매일매일 새롭고 너무나 행복했던 순간을 만들어준 곽지해수욕장 다음 제주 여행때도 가고 싶어요.,곽지해수욕장,자연
자전거순환종주하면서 들였는데 주위에 장한철산책로도 있어서 가족끼리 산책도할수 있고 젤루 좋은건 머니머니해도 노천탕 진짜 민물이 나와서 가볍게 씻기좋아요 정말피로가 싹 가시더라구요 강추합니다,곽지해수욕장,자연
"가족들과의 소중한 제주여행
곽지해수욕장",곽지해수욕장,자연
필름 카메라로 담은 곽지과물해수욕장의 해질녘 제주가 너무 좋아서 집에 오자마자 12월 비행기 티켓을 구매 하였다.,곽지해수욕장,자연
보기만해도 좋은 바다. 아이들은 물놀이도 좋지만 맑은 바다에서 나는 것들을 보고 만지는 경험도 너무나좋다. 맑은바다 곽지해변에서 아이들과함께한 행복한시간,곽지해수욕장,자연
