귀여운 곰돌이가 가득한 박물관으로 넓은 공간에 예쁘게 잘 꾸며져 있어서 아이들뿐만 아니라 테디베어를 좋아하는 어른들이 보기에도 좋은 곳입니다.,제주 타지움 박물관,레저/체험
"지금은 다양한 만화 캐릭터로 인기가 조금 시들해졌지만, 다양한 테디베어를 직접 보고 만져볼 수도 있어서 아이들과 가기에 좋은 곳이다. 자녀가 미취학 아동이라면 더욱 방문 추천. 테디베어와 기념 사진 찍기에도 좋다.",제주 타지움 박물관,레저/체험
인형 좋아하고 아기 있는 집은 너무 좋을거 같지만 성인이고 아기자기한거에 큰 관심은 없어서 그럭저럭 보고 왔어요 ^^  소소하게 시간 보내기 좋아요,제주 타지움 박물관,레저/체험
인형 마을이네요. 다양한 종류의 인형들이 가득합니다. 하지만 인형을 그렇게 좋아하지 않는 사람에겐 그냥 한번 보고 지나칠 뿐이겠지요.  아이가 있으면 괜찮겠네요.,제주 타지움 박물관,레저/체험
"인형을 좋아하는 사람이라면 꼭 가봐야 하는 곳입니다. 마지막에는 아주 큰 곰인형도 있고, 기념품점에는 관람했던 인형들이 가득 있었어요. 공항에서 가까워요.",제주 타지움 박물관,레저/체험
"어린아이들을 동반한 여행을 할 때 찾아가면 좋은 곳. 규모는 크지 않으나, 아기자기한 동물들로 가득채워져 있어서 아기들이 특히나 좋아하는 곳.",제주 타지움 박물관,레저/체험
어린이들이 좋아하는 테디베어박물관~~~ 그리고 커플들도 많이 보였어요.. 작고 아기자기한 동물 모형들 귀여워서 사진 많이 찍었어요. 특히 어린애들이있는 가족 관광지로 강추합니다~~,제주 타지움 박물관,레저/체험
비수기이고 오전에 가서 그런지 일단 사람들이 없어서 좋았어요. 2층에서 일하시는 언니가 가족사진도 잘 찍어주시고 애기도 예뻐해주시고.. 이런 저런 안내도 잘해주셔서 고마웠구요. 우리 딸은 22개월 됐는데.. 들어가자마자 동물 인형들 보고서 완전 좋아했어요. 거기서 살 기세였지요 ㅋ 포토존 완전 짱이에요,제주 타지움 박물관,레저/체험
아이와 가기도 참 좋은 곳입니다! 아기지가하니 사진찍기도 참 좋은 곳이예요~ 가족끼라 여행 시에 가보면 참 좋을 곳입니다^^,제주 타지움 박물관,레저/체험
테디베어 관련 관람 시설이 제주에도 몇군데 있는데요 서귀포 쪽이 공연 중심이라면 이곳은 전시 중심이라서 사진 촬영하기에 보다 적합하구요 아이가 너무 좋아하더라구요 요우커도 많더라구요,제주 타지움 박물관,레저/체험
커플보다는 아이를 동반한 가족이 더 즐길 수 있는 곳. 귀여운 곰돌이들이 많이 아이들이 좋아하며 관광지가 몰려있어 코스를 잘 짜면 이동하며 들르기에도 좋음.,제주 타지움 박물관,레저/체험
전시도 잘 되어있고 그냥 구경하는 것 만으로도 재미있네요. 여러번은 아니고 한번쯤 가볼만한 것 같아요.,제주 타지움 박물관,레저/체험
테디베어 인형으로 테마별로 여러가지 잘꾸며 놓은 곳 입니다. 아이가 있으신분들이나 테디베러 인형을 좋아 하시는 분들께 추천 드리는 장소 입니다.,제주 타지움 박물관,레저/체험
"테지움이 크지는 않은데, 테디베어 인형으로 여러가지 잘 꾸며져 있어서 아기자기하게 구경하기 좋구요. 몇 가지 인형들은 아이들이 직접 만져볼수 있기도 하구요. 사진 찍어도 예쁘게 잘나옵니다.",제주 타지움 박물관,레저/체험
테디베어와 비교해서 관람 이외에도 만져보고 가까이 할 수 있는 점이 좋았어요. 테디베어가 세련됐다면 테지움은 좀 더 친근합니다^^,제주 타지움 박물관,레저/체험
공항 근처에 위치하고 있어 첫날이나 마지막날 일정잡기에 좋으며 아이들과 사진찍기 좋은 장소입니다.,제주 타지움 박물관,레저/체험
아이가 있으시면 들러보면 좋은 곳입니다. 유아동반에는 추천합니다.,제주 타지움 박물관,레저/체험
"제주 테지움 사파리는 다양한 구역으로 나뉘어져 있는데 구역마다 여러 동물들을 볼 수 있어요. 테마별로 귀여운 동물들이 가득있어 아이들은 좋아할 것 같지만 아이들이 타거나 놀 수 있을 만한 것은 없고, 전시위주입니다. 인형을 좋아하지않는 성인 남자분들은 무료할 수도 있습니다. 입장료도 저렴하진 않았고 직원들도 무뚝뚝하여 매우 아쉬웠습니다.",제주 타지움 박물관,레저/체험
"모든 종류의 푹신한 모의 동물 장난감은 그들의 실물 크기에 맞게 제작되었습니다. 아이들에게는 엄청난 즐거움이죠. 많은 진열품과 함께 사진 포즈를 취할 수도 있고 진열품 위에 앉을 수도 있습니다. 또한, 전문가들에 의해 제작된 유명한 모조 테디 베어 작품이 진열되어 있습니다. 세계 각국의 다른 전통 의상을 입은 곰 인형들도 있습니다.",제주 타지움 박물관,레저/체험
"이곳은 사파리를 주제로 한 테디 베어 박물관입니다. 이곳에는 기린, 얼룩말, 양, 원숭이 판더, 기타 등등을 포함한 모든 종류의 인형들이 있습니다. 2층에는 심지어 크리스털로 장식된 이집트 주제의 곰 인형들도 있더군요. 이 기회를 절대 놓치지 마세요. 또한, 2층에는 국제 곰 인형들이 진열되어 있어요. 기념품 가게에서 기념품으로 곰 인형을 사는 기회도 절대 놓쳐서는 안 됩니다. 선택의 폭이 너무 넓어서 결정하기가 힘들 정도예요. 모든 곰 인형들은 한국에서 만들어졌고 소장용으로 구매하기에 가치가 있습니다.",제주 타지움 박물관,레저/체험
"남편과 나는 5 월 1 일이 곳을 방문했다. 이 테디 베어 박물관에는 사진 촬영의 기회가 있습니다. 다른 리뷰와 달리, 나는 그것이 작다고 말하지 않을 것이다. 사파리 섹션, 수중 섹션과 로열티 섹션이 있었다. 우리는 약 30 ~ 60 분 정도있었습니다. 그것은 꽤 꾸렸다.",제주 타지움 박물관,레저/체험
"그것은 꽤 작은 곳이지만 많은 귀여움으로 가득 차 있습니다. 사파리 테마, 로얄 테마. . . 테디 베어 박물관과는 다르지만 테디 베어를 좋아한다면 적어도 한 번 방문 할 가치가 있습니다.",제주 타지움 박물관,레저/체험
나 같은 테디 애호가에게는 이곳이 천국입니까? 나는 다른 흙을 모으고 모든 종류의 흙을 여기에서 보았습니다. 크고 작은 것은 꿈이 이루어지듯합니다. 아이들과 아이들은 마음껏 즐기며 보물을 보냅니다.,제주 타지움 박물관,레저/체험
"테디 베어의 모든 크기와 크기가 유명한 미술품, 우화, 동화 등을 개성있게 보여주는 데 사용되는 재미있는 쇼케이스입니다. 많은 흥미로운 사진 기회가 있습니다. 한국인들은 테디 베어 애호가들에게 헌정 된 그런 박물관을 찾는 데 매우 창의적이지만 두 번째로 돌아 오지는 않을 것입니다.",제주 타지움 박물관,레저/체험
아이들은 그것을 좋아할 것입니다. . . . 아주 작은 것에서 거대한 크기의 옷을 입은 많은 인형들. 인형도 찍을 수 있습니다. 테디 베어 이외에는 볼거리가별로 없습니다.,제주 타지움 박물관,레저/체험
"비오는날 아기들하고 함께가면 좋은 장소입니다. 공연도 한시간 알차게 구성되어 있고, 추억 사진도 출력할 수 있어서 좋았습니다.",중문 마린 퍼시픽 랜드,레저/체험
"제주 퍼시픽랜드의 마린 스테이지 공연 입니다. 40분 정도 진행되고, 멍키 빌리지, 바다 사자 빌리지,돌고래 빌리지 로 공연이 구성 되어 있습니다. 원숭이 들의 재주와 바다사자, 돌고래들의 묘기를 볼수 있습니다. 같은 퍼시픽랜드의 다른 건물에 엘 마리노 뷔페 레스토랑도 있습니다.",중문 마린 퍼시픽 랜드,레저/체험
뷔페식당은 바다의 전망을 보면서 식사를 할 수있는곳이고 낙조의 아름다움을 감상할 수 있다. 음식도 싱싱한 해산물의 맛을 느낄수 있고 고기의 질도 좋다. 전체적으로 음식도 맛있고 전망까지 좋아 만족스러운 식사를 할 수 있는곳이다,중문 마린 퍼시픽 랜드,레저/체험
"중문 색달 해변 주차장 바로 옆에 있어서 중문해변과 묶어서 산책하기 좋은 코스입니다. 돌고래쇼를 볼 수 있는 공연장과 편의점, 빵집, 뷔페, 펍 등 다양한 시설이 몰려있는 곳이니 산책과 식사 모두가 가능합니다. 요트와 제트보트도 탈 수 있는 정박장도 있고, 공연장 뒤쪽 절벽쪽에서 바라보는 바다도 탁 트여 가슴까지 시원해지는 경치를 선사하는 곳입니다. 식당이나 공연장 등을 이용하지 않는다면 비용을 들이지 않고 산책을 즐길 수 있으니 한번쯤 가보세요.",중문 마린 퍼시픽 랜드,레저/체험
저희는 첫째는 케이팝 박물관을 가고 둘째가 퍼시픽랜드를 갔는데 많이 재밌어하고..인형들도 예쁜걸 많이 팔아서 인형도 구매해서 오고..아주 좋았던것 같습니다.,중문 마린 퍼시픽 랜드,레저/체험
"요새 요트타기 좋은날씬데요~ 저는 여자친구와 갔다가 날씨도 흐리고, 이쁜옷입고 갔더니 구명쪼끼 입혀주시고~ 그러는 바람에 여자친구가 속상해서 울었어요 ㅋㅋㅋ 참고하세요~",중문 마린 퍼시픽 랜드,레저/체험
"분위기 좋은 카페겸 펍이 있습니다 해수욕장을 옆에 끼고 중문 해안가가 한눈에 보이는 뷰도 되게 좋네요 애들데리고 가족끼리 왔을때는 돌고래쇼, 요트투어 해도 재밌고 커플끼리 오면 펍에서 칵테일마시면서 노을보는것도 좋고 사진도 잘나옵니다",중문 마린 퍼시픽 랜드,레저/체험
원숭이돌고래쇼도 좋았지만 요트투어도 정말 좋았네요.시간이 좀 짪은듯 해서 아숴웠지만...럭셔리한 느낌 ...회랑 소주도 한잔할수이쏘 낚시도 ...ㅋㅋ,중문 마린 퍼시픽 랜드,레저/체험
"한시간 코스의 요트투어 했는데, 꽤 재미있어요. 낚시도 해보고 주상절리대 구경도 할수 있고요. 직원분들이 사진도 찍어줘서 기분 좋게 즐기다 왔어요",중문 마린 퍼시픽 랜드,레저/체험
원숭이 바다사자? 돌고래쇼가 50분 정도 하네요. 5살 아이는 좋아합니다 돌고래쇼는 조련사도 물에 들어가 같이 공연을 하는게 특이했네요.쇼 이후 돌고래랑 유료 포토타임도 가질수 있어요,중문 마린 퍼시픽 랜드,레저/체험
"원숭이, 돌고래, 바다사자 쇼를 하는 곳으로 6세, 8세 어린이가 있어서 방문하게 되었습니다. 개인적으로는 아쿠아플라넷에서 하는 쇼보다 재미있다고 생각이 되었고, 마지막에 돌고래와 사진 찍을수 있는 기회를 주는 것도 좋았습니다. 유료이긴하지만 비교적 저렴한 비용으로 아이들에게 좋은 추억이 될 수 있을 것 같습니다.",중문 마린 퍼시픽 랜드,레저/체험
"샹그릴라 요트 투어를 재밌게 했습니다. 술과 간식을 제공하고 1시간 쯤 돌아보는데 꽤 재밌었습니다. 날씨가 좋아 배도 별로 안흔들렸구요. 낚시 잠깐하는데 작은 물고기 한자리 잡았고, 다시 놓아주었는데 아이와 함께한 즐거운 경험이었습니다.",중문 마린 퍼시픽 랜드,레저/체험
요즘 돌고래쇼를 보기 힘들어요. 아이들에게는 최고입니다. 티몬등에서 미리 구입하면 절약할 수 있어요,중문 마린 퍼시픽 랜드,레저/체험
"원숭이, 바다사자, 돌고래의 3종 쇼 볼만했어요. 5살 아이가 정말 좋아하더군요. 옆 자리에 50~60대 아주머니들 앉아계셨는데 그 분들도 정말 재미있게 보시더군요. 아이나, 부모님 모시고 간 가족여행객들은 가보시면 좋을거 같아요. 다 끝나고 돌고래랑 손잡고 폴라로이드 사진 찍는거 아이가 하고 싶다고 해서 하긴 했으나, 좀 비싼감이.. 그래도 추억이니 하게 되더라구요.",중문 마린 퍼시픽 랜드,레저/체험
공연에 나오는 원숭이 바다사자 돌고래 쑈보고난뒤 돌고래랑 악수하면서 사진찍는데~~ 아이들이 참좋아하더라구요!! 아이들이 있다면 추천드려요!!!,중문 마린 퍼시픽 랜드,레저/체험
저는 비오는날방문했는데요 시스템은 올드하나 쇼는 그래서 구경할만 했습니다. 다만 조금더 잘 했으면 좋겠ㅇ요,중문 마린 퍼시픽 랜드,레저/체험
해양레져 테마파크 답게 중문해수욕장 바로옆에 있으며 아이들이 좋아하는 퍼시픽랜드 돌고래쇼장과 그라고 샹그릴라요트장 그리고 뷔페식당까지 다양한 경험을 할수있는 곳이였답니다.,중문 마린 퍼시픽 랜드,레저/체험
"기존에 입장료는 비싼편이라서 소셜로 미리 구입해서 좀 저렴하게 구입했구요, 원숭이쇼, 바다사자쇼, 돌고래쇼로 구성되어서 50분정도 했어요. 어른관광객도 꽤 많은편이었는데, 쇼는 아이들보기에 적당했던것 같아요.",중문 마린 퍼시픽 랜드,레저/체험
저렴한 가격으로 동물쇼를 관람할 수 잇어요. 한시간 입니다. 아이와 함께나 부모님과 함께도 관람하기 괜찮더라고요,중문 마린 퍼시픽 랜드,레저/체험
"원숭이, 물개, 돌고래 등의 동물 쇼를 관람할 수 있습니다. 한시간 동안 쇼가 진행됩니다.",중문 마린 퍼시픽 랜드,레저/체험
"퍼시픽랜드는 요트를 탈 수 있는 곳으로, 한 시간 정도 코스의 요트는 꼭 타 볼만 합니다. 재미있고, 요트에서 가벼운 낚시도 즐길 수 있습니다.",중문 마린 퍼시픽 랜드,레저/체험
돌고래 원숭이 보고 왔습니다. 아이가 무척이나 좋아했고요. 주차도 정말 편하게 할수 있어서 좋았구요 . 돌고래를 가깝게 볼수 있어서 아이가 너무 좋아했어요.,중문 마린 퍼시픽 랜드,레저/체험
"제주에 1년에 두 번은 가는데, 두번에 한 번은 꼭 들르는 것 같네요. 아이들이 그만큼 좋아해요. 아쿠아플라넷이 성산쪽에 있고 그곳이 좀 세련되다면, 여긴 저렴하고 친근해요ㅋ 좌석이라든지 시설이 좀 오래되고 지저분한 감은 있네요. 시간 잘 체크하고 가셔야 해요. 그리고 앞자리 앉는 게 여러 이벤트에도 좋고 보기도 좋아요.",중문 마린 퍼시픽 랜드,레저/체험
돌고래 공연 아이들이 좋아해요. 퍼시픽랜드 주변에 풍경이 좋아 산책하기도 좋아요. 요트는 빠른 스피드로 주상절리 근처까지 가고 위험해서 애들은 타면 안되겠어요. 음식도 괜찮은데 중국인들이 너무 많아요.,중문 마린 퍼시픽 랜드,레저/체험
"표 하나로 원숭이/물개/돌고래 공연을 볼 수 있습니다. 짜임새 있는 공연이고, 특히 아이들이 좋아할 만한 공연입니다. 시푸드 레스토랑과 중국식 뷔페가 인접해 있습니다. 건물 뒤쪽으로 가면 중문색달해변이 한 눈에 보이는 정원이 있습니다.",중문 마린 퍼시픽 랜드,레저/체험
처음에는 별로 기대를 안하고 방문하였는데 .. 막상 공연을 보고나니까 원숭이도 너~무 귀여웠다! 특히 돌고래쇼가 너무 재밌었다! 공연이 끝나고 돌고래의 애교를 볼 수 있는 시간도 있어서 정말 동물들과 교감할수 있는 시간이었다.,중문 마린 퍼시픽 랜드,레저/체험
"오롯이 공연만, 공연을 통해서만 바다 친구들을 만날 수 있는 공간입니다. 아쿠아플래닛이 부담스럽다면 이곳 추천해드립니다. 아무래도 공연만을 주관해서 그런지 공연이 생각보다 알찹니다. 1부, 2부 ,3부에 특별공연까지 총 4회의 공연이 이어지며 원숭이, 돌고래, 바다사자 등 각기 다른 동물 출연, 중간중간 이벤트도 진행하고 아이들도 좋아라, 어른도 좋아라, 즐겁게 웃다 왔습니다. 공연 중에 가장 흥미롭게 본 공연, 돌고래공연!",중문 마린 퍼시픽 랜드,레저/체험
"이지역사람들에게 매우 인기있는 곳 같았어요. 돌고래 쇼도 하고, 보트를 대여해서 야생 돌고래를 볼수 도 있고 다양한 해상 스포츠를 즐길 수 있어요. 다 한글로 적혀있고 영어로 된 설명이 없어서 그냥 해산물 부페 먹었고요, 이 지역 생맥주 마셨어요. 조개구이와 게살 수프가 맛있었어요.",중문 마린 퍼시픽 랜드,레저/체험
"해산물 부페에 가려고 퍼시픽 랜드에 갔었어요.(상그리라 씨푸드 클럽) 괜찮았어요. 레스토랑이 이 지역사람들로 붐비더라고요. 이 휴양지는 음악이 흘러나오고, 크루즈나 해변 썬배드를 빌릴 수 있습니다.",중문 마린 퍼시픽 랜드,레저/체험
"귀여운 원숭이 4마리와 애교있는 바다사자 4마리가, 각자 공이나 악기등 소도구를 사용해 즐거운 재주를 보이면, 드디어 돌고래쇼. 넓다라고는 말할 수 없는 수영장이지만, 4마리 돌고래와 트레이너가 호흡을 맞춰 댄스나 점프를 보여줘, 일본 수족관의 돌고래쇼를 넘을 정도로 완성도가 높습니다.
돌고래와 수영하는 것을 꿈꾸는 사람에게는 동경하는 쇼가 되겠지요.",중문 마린 퍼시픽 랜드,레저/체험
"50 분 좋은 쇼! 우리는 그들의 언어를 이해하지 못하지만. 소개는 약간 잔소리가 있지만 전체적으로 쇼는 여전히 우리에게 좋습니다! 그것은 소개, 원숭이 쇼, 물개 및 돌고래로 시작되었습니다. 공연 후 돌고래와 함께 사진을 찍을 수는 있지만 10k 원의 사진 티켓을 이용할 수 있습니다. 나는 개인적으로 돌고래와 매우 가까운 곳에서 사진을 찍을 수 있기 때문에 합리적이라고 생각합니다. 언어 제약으로 인해 사진 티켓을 얻을 수 없습니다. 우리가 이것을 알고 있다면, 우리는 즉시 카운터를 통해 그것을 구입할 것입니다. 밖에는 기념품 가게가 있으며, 밖에는 많은 레스토랑 / 카페가 있습니다. 입장권은 성인 15k 및 어린이 10k입니다.",중문 마린 퍼시픽 랜드,레저/체험
스피드가 있고 야외에서 하는 것이라 저는 좋았읍니다. 물론 아이들도 좋아하고 어르신들은 더 좋아합니다. 약간의 먼지와 냄새는 양해하시길.,더 마파크,레저/체험
"더마파크 공연과 카트의 조합은 환상이네요.가성비로 보나 퀄리티로 보나 최고입니다. 탁월한 선택이었음에 뿌듯하기까지~~ 5인 가족이어서 카트는 추가 비용 8000을 따로 지불했지만, 기분 나쁘거나 하지는 않았네요. 암튼 강추^^",더 마파크,레저/체험
"어르신들 모시고 다녀 왔습니다. 볼만하고 괜찮습니다. 시설도 쾌적하고 괜찮았지만, 야외 공연장이라 한여름 그늘에 앉아 있어도 더울땐 관람이 힘들 듯하구요. 코믹적인 요소도 있고 쇼적인 부분이 많아 서커스 대신 관람하기 좋습니다.",더 마파크,레저/체험
생각보다 긴 공연~,더 마파크,레저/체험
아이들이 좋아할거 같아요,더 마파크,레저/체험
마상 공연을 볼 수 있는 곳,더 마파크,레저/체험
"이 곳에서 승마체험, 야외 카트 체험, 마상 공연을 볼 수 있는 곳입니다. 각각 이용료는 별도입니다. 마상공연은 오래 전에 TV에서 상영했던 드라마 '주몽'을 모티브로 한 것입니다. 말 위해서 하는 묘기와 다양한 공연이 참 보기 좋았습니다. 공연은 50분 정도 하는 데 제 개인적으로는 아깝지 않았습니다. 보시는 것을 추천합니다.",더 마파크,레저/체험
마지막 날 남편이 꼭 보고싶어해서 들린 '더 마 파크'! 사실 제주에서 본 공연에 실망을 많이 한 터라 큰 기대를 하지 않았는데 왠걸ㅎ 시작부터 끝나는 순간까지 긴장감에 심장이 쫄깃해지면서 통쾌하기까지... 제주를 간다면 꼭 들러야 할 곳 TOP3 안에 든다고 할 정도로 강추함,더 마파크,레저/체험
기대보다 즐거웠던 공연,더 마파크,레저/체험
"아이템이 부족했던 겨울 제주도 여행에서 아마 가장 흥미로웠던 장소가 아닌가 싶다. 의외로 우리나라에도 볼만한 마이너 공연들이 꽤 많다. 제주도 하면 또 말 아닌가, 여행 테마에도 맞고. 야외라서 겨울엔 좀 춥긴 하지만, 좌석에서 열기도 나오고 담요도 대여할 수 있어 참기 어려울 정도는 아니다.",더 마파크,레저/체험
"이곳은 라온 아울렛 옆에 있어요. 밖에는 조랑말 승마체험장이 있고 중앙에 공연장이 있습니다. 공연장은 10시부터 입장 가능한데 사람들이 갑자기 몰리기도 하지만 마상공연을 제대로 즐기려면 앞자리가 낫죠. 10시 전에 줄 서라는 말입니다. 공연은 몽고인들이 하는데 멋지고 재미납니다. 아이, 어른, 남녀 상관없이 웃게 됩니다. 참! 몽고청년들이 말 먹이주기 체험 하라고 당근을 1천원에 하나씩 팔거든요. 그게 그분들 수익이라니 챙겨주세요",더 마파크,레저/체험
"칭기즈칸의 삶을 재현한 멋진 쇼다. 승마술과 곡예가 훌륭하고, 내 생각에 기수들은 남녀 모두 몽골 출신인 것 같다. 승마체험도 할 수 있는데 가이드가 고삐를 잡고 제어한다. 쇼는 한국어 해설과 중국어 약간이지만, 액션은 그 자체로 말한다. 찾아가기 좀 거시기하지만 차를 렌트하거나 교통수단이 있다면 완전 추천한다!",더 마파크,레저/체험
"제주도는 말과 관화로 잘 알려져 있습니다. 제주를 처음 방문하는 사람들에게는 꼭 봐야 할 곳입니다. 티켓은 Trazy에서 온라인으로 구입할 수 있습니다. com. 24 시간 이내에 전자 항공권을 받아야합니다. 그런 다음 The Ma park의 티켓 부스에서 이것을 교환하십시오. 거기에 도착하기 위해 우리는 혜재 해수욕장에서 택시를 탔습니다 (비용 9,000 원). 한정된 좌석으로 인해 미리 티켓을 구매해야합니다. 많은 민간 관광 버스가 여기에갑니다. 이 지역에서는 대중 교통이 매우 드 sel니다. 왕복 교통편을 주선 할 수 있다면 그렇게하십시오. 우리는 2KM을 주요 도로로 걸어갔습니다. 그러나 다시 한 번 Hr 쇼는 볼만한 가치가 있습니다. =)",더 마파크,레저/체험
제주도 마 공원에서 공연을 보러 오세요! 승마에서 곡예 및 쇼맨쉽에 이르기까지이 쇼는 젊은 나이에 훌륭한 가족 경험입니다.,더 마파크,레저/체험
"친절한 직원 : 최선을 다해 영어로 의사 소통하기 위해 열심히 노력했습니다. 우리는 승마를위한 코스를 택했습니다. 지도자는 제가 경험 많은 라이더 인 것처럼 저의 말을 인도 할 수있게 해주었습니다. 지도자는 내 딸의 말을 인도했습니다. 말은 친절한 기질로 잘 훈련 받았다. 말 쇼는 잘 연습되었고 라이더와 말은 숙련되었습니다. 내 딸은 8 살이고 그녀는 쇼를 좋아했습니다. 쇼가 끝난 후, 우리는 당근을 1000 KWN에 달하는 말에 당근을 먹였습니다. 나는 승차권을 구입하는 것이 좋습니다. 승차권은 95 분 동안 기다려야 승차 할 수 있습니다.",더 마파크,레저/체험
"티켓은 온라인 구입한 할인 즐길 수 있습니다. 아침 일찍 주차장 내에서 첫 번째 자동차 중. 따라서 우리는 소란스럽지 았습니다 말을 아이들을 위한 승마 경험을 했습니다. 50분 성능 또한 아이들이 참 좋았어요. 불행히도, 카트 간다 전에 몇 시간 동안 비가 제공되지 않았습니다.",더 마파크,레저/체험
"전 제주도 여행 할 수 있는 인식도 있고 말을 타 쇼. 우리의 가이드 를 해주는 공연이 라고 하는 말. 확인합니다. 기대할 수 없었던 것. 표시 및 표시되어 있는 한국인 관광객이 마치고 한국말이 다. 하지만, 영어 가 된다거나. 그 중에 외국인들을 보지 못했다. 표시 작업이 많은 아레나 및 지속 시간. 한 가지 경우 이 좌석이 비. 표시되어 있는 다 도중 카운티까지 invasions 중에 몽골어 의 한국 1200 s. 해 준 모의 경쟁, 기술 표시되는 양궁 승마, 수행할 보관, 및 기타 다양한 기술을 습득할 수 있습니다. 생각이 쇼는 오락, 수행할 뿐만 아니라, 라이더 시설들이 아주 재능 있는 몽골. 제 3 년 된, 조금 무서워 십 수 있습니다. 신경 써주고 한 말인지 것을. 시작 및 끝 표시 로 당근 먹이 말 구입할 수 있습니다. 한 사람의 공연은 18, 000원, 우리의 가이드는 우리가 할인을 받을 수 있지만. 전반적으로. 즐거운 생각은 다시 가고 다.",더 마파크,레저/체험
